{"approved":true,"identity":"dev.lekalo.evaluation-export-input@0.6.4","protocol":"framework-lift-paired-trials/1","schema_version":"lekalo/evaluation-export-input/v0.6.4","trials":[{"arm":"baseline","requiredAssertions":[],"runId":"11111111111111111111111111111111","unit":"trial-01"},{"arm":"lekalo-assisted","requiredAssertions":[],"runId":"22222222222222222222222222222222","unit":"trial-01"}]}
